{
  "name": "rss",
  "name_zh": "RSS订阅",
  "name_en": "RSS",
  "version": "1.1.0",
  "description": "RSS/Atom 订阅监控插件，自动检测更新并推送通知",
  "author": "HologramAgent",
  "entry": "plugin.so",
  "tags": [
    "rss",
    "feed",
    "subscription",
    "monitor"
  ],
  "targets": "linux/amd64",
  "outdir": "dist",
  "bundle": true,
  "replaces": {},
  "source_dirs": []
}