{
  "name": "sanitizer",
  "name_zh": "输出清洗",
  "name_en": "sanitizer",
  "version": "0.1.0",
  "description": "清洗 LLM 输出中的工具调用残留（思维泄漏）",
  "author": "HologramAgent SDK",
  "entry": "plugin.so",
  "tags": ["sanitizer"],
  "targets": "linux/amd64",
  "outdir": "dist",
  "bundle": true,
  "replaces": {},
  "source_dirs": []
}
