{
  "name": "qq",
  "name_zh": "QQ消息",
  "name_en": "qq",
  "version": "1.4.4",
  "description": "QQ 消息收发插件，通过 NapCat 协议桥接",
  "author": "HomeAgent",
  "entry": "plugin.so",
  "tags": [
    "qq",
    "messaging"
  ],
  "targets": "linux/amd64",
  "outdir": "dist",
  "bundle": false,
  "replaces": {},
  "source_dirs": []
}